{
    "$schema": "events.schema.json",
    "bg_events": [],
    "npcs": [
        {
            "id": 0,
            "model": 22,
            "movement": 0,
            "type": 0,
            "flag": 0,
            "script": 2,
            "direction": 2,
            "params": [ 0, 0, 0 ],
            "area": {
                "width": 0,
                "height": 0
            },
            "grid": {
                "x": 3,
                "z": 6,
                "y": 0
            }
        },
        {
            "id": 1,
            "model": 126,
            "movement": 0,
            "type": 0,
            "flag": 0,
            "script": 3,
            "direction": 3,
            "params": [ 0, 0, 0 ],
            "area": {
                "width": 1,
                "height": 1
            },
            "grid": {
                "x": 2,
                "z": 6,
                "y": 0
            }
        },
        {
            "id": 2,
            "model": 44,
            "movement": 0,
            "type": 0,
            "flag": 0,
            "script": 1,
            "direction": 1,
            "params": [ 0, 0, 0 ],
            "area": {
                "width": 0,
                "height": 0
            },
            "grid": {
                "x": 7,
                "z": 4,
                "y": 0
            }
        },
        {
            "id": 3,
            "model": 312,
            "movement": 3,
            "type": 0,
            "flag": 0,
            "script": 5,
            "direction": 1,
            "params": [ 0, 0, 0 ],
            "area": {
                "width": 0,
                "height": 0
            },
            "grid": {
                "x": 4,
                "z": 8,
                "y": 0
            }
        },
        {
            "id": 4,
            "model": 325,
            "movement": 3,
            "type": 0,
            "flag": 0,
            "script": 7,
            "direction": 1,
            "params": [ 0, 0, 0 ],
            "area": {
                "width": 1,
                "height": 1
            },
            "grid": {
                "x": 4,
                "z": 3,
                "y": 0
            }
        },
        {
            "id": 5,
            "model": 131,
            "movement": 38,
            "type": 0,
            "flag": 0,
            "script": 4,
            "direction": 1,
            "params": [ 0, 0, 0 ],
            "area": {
                "width": 1,
                "height": 1
            },
            "grid": {
                "x": 9,
                "z": 7,
                "y": 0
            }
        },
        {
            "id": 6,
            "model": 316,
            "movement": 3,
            "type": 0,
            "flag": 0,
            "script": 6,
            "direction": 1,
            "params": [ 0, 0, 0 ],
            "area": {
                "width": 0,
                "height": 0
            },
            "grid": {
                "x": 8,
                "z": 4,
                "y": 0
            }
        }
    ],
    "warps": [
        {
            "zone": "ZONE_ICIRRUS_CITY",
            "warp": 5,
            "unk4": 1,
            "transition": 1,
            "grid": {
                "x": 88,
                "y": 0,
                "z": 168,
                "width": 3,
                "height": 1,
                "unk0a": 0
            }
        }
    ],
    "triggers": [],
    "init_scripts": []
}
