{
    "$schema": "events.schema.json",
    "bg_events": [],
    "npcs": [
        {
            "id": 0,
            "model": 295,
            "movement": 0,
            "type": 0,
            "flag": 763,
            "script": 3,
            "direction": 1,
            "params": [ 0, 0, 0 ],
            "area": {
                "width": 0,
                "height": 0
            },
            "grid": {
                "x": 8,
                "z": 3,
                "y": 65536
            }
        },
        {
            "id": 1,
            "model": 372,
            "movement": 0,
            "type": 0,
            "flag": 0,
            "script": 5,
            "direction": 1,
            "params": [ 0, 0, 0 ],
            "area": {
                "width": 0,
                "height": 0
            },
            "grid": {
                "x": 5,
                "z": 2,
                "y": 65536
            }
        },
        {
            "id": 2,
            "model": 297,
            "movement": 0,
            "type": 0,
            "flag": 0,
            "script": 6,
            "direction": 1,
            "params": [ 0, 0, 0 ],
            "area": {
                "width": 0,
                "height": 0
            },
            "grid": {
                "x": 11,
                "z": 3,
                "y": 65536
            }
        },
        {
            "id": 3,
            "model": 358,
            "movement": 0,
            "type": 0,
            "flag": 720,
            "script": 7,
            "direction": 0,
            "params": [ 0, 0, 0 ],
            "area": {
                "width": 0,
                "height": 0
            },
            "grid": {
                "x": 11,
                "z": 14,
                "y": 0
            }
        },
        {
            "id": 4,
            "model": 224,
            "movement": 0,
            "type": 0,
            "flag": 721,
            "script": 4,
            "direction": 1,
            "params": [ 0, 0, 0 ],
            "area": {
                "width": 0,
                "height": 0
            },
            "grid": {
                "x": 8,
                "z": 3,
                "y": 65536
            }
        },
        {
            "id": 5,
            "model": 55,
            "movement": 12,
            "type": 1,
            "flag": 0,
            "script": 9,
            "direction": 0,
            "params": [ 0, 0, 0 ],
            "area": {
                "width": 0,
                "height": 0
            },
            "grid": {
                "x": 2,
                "z": 14,
                "y": 65536
            }
        }
    ],
    "warps": [
        {
            "zone": "ZONE_VIRBANK_CITY_GYM",
            "warp": 0,
            "unk4": 1,
            "transition": 1,
            "grid": {
                "x": 120,
                "y": 0,
                "z": 248,
                "width": 3,
                "height": 1,
                "unk0a": 0
            }
        }
    ],
    "triggers": [
        {
            "script": 8,
            "var": 16557,
            "value": 1,
            "type": 0,
            "grid": {
                "x": 3,
                "z": 6,
                "width": 2,
                "height": 1,
                "y": 0
            },
            "unk14": 0
        }
    ],
    "init_scripts": [
        {
            "type": 2,
            "script": 1
        },
        {
            "type": 4,
            "script": 2
        }
    ]
}
