{
    "$schema": "events.schema.json",
    "bg_events": [
        {
            "script": 1,
            "condition": 1,
            "direction": 0,
            "grid": {
                "x": 103,
                "y": 343,
                "z": 16
            }
        }
    ],
    "npcs": [],
    "warps": [
        {
            "zone": "ZONE_CHARGESTONE_CAVE_2",
            "warp": 0,
            "unk4": 2,
            "transition": 4,
            "grid": {
                "x": 1720,
                "y": 16,
                "z": 5432,
                "width": 1,
                "height": 1,
                "unk0a": 0
            }
        }
    ],
    "triggers": [],
    "init_scripts": []
}
