{
    "$schema": "events.schema.json",
    "bg_events": [],
    "npcs": [
        {
            "id": 0,
            "model": 343,
            "movement": 0,
            "type": 0,
            "flag": 0,
            "script": 2000,
            "direction": 3,
            "params": [ 0, 0, 0 ],
            "area": {
                "width": 0,
                "height": 0
            },
            "grid": {
                "x": 6,
                "z": 18,
                "y": 0
            }
        },
        {
            "id": 1,
            "model": 343,
            "movement": 0,
            "type": 0,
            "flag": 0,
            "script": 2000,
            "direction": 2,
            "params": [ 0, 0, 0 ],
            "area": {
                "width": 0,
                "height": 0
            },
            "grid": {
                "x": 8,
                "z": 18,
                "y": 0
            }
        },
        {
            "id": 2,
            "model": 342,
            "movement": 0,
            "type": 0,
            "flag": 0,
            "script": 2000,
            "direction": 3,
            "params": [ 0, 0, 0 ],
            "area": {
                "width": 0,
                "height": 0
            },
            "grid": {
                "x": 5,
                "z": 10,
                "y": -196608
            }
        }
    ],
    "warps": [],
    "triggers": [],
    "init_scripts": []
}
